type,name,label::English,label::Arabic,hint::English,hint::Arabic,required,relevant,choice_filter,constraint,constraint_message::English,constraint_message::Arabic,calculation,appearance,repeat_count,,,,,,,,,,,
select_one ynd,hospital_maternity_ser,43.2 Does the hospital provide maternity services?,هل يقدم هذا المشفى خدمات الامومة؟,,,true,,,,,,,,,,,,,,,,,,,
select_one ynd,hospital_surgical_ser,43.3 Does the hospital provide surgical services?,هل يقدم المشفى خدمات عمليات؟,,,true,,,,,,,,,,,,,,,,,,,
select_one ynd,hospital_pediatric_ser,43.4 Does the hospital provide pediatric services?,هل يقدم المشفى خدمات طب الاطفال؟,,,true,,,,,,,,,,,,,,,,,,,
end_group,hospital_ser,,,,,,,,,,,,,,,,,,,,,,,,
select_one yndd,women_specialised_services,46. Do women of reproductive age (12-49) have access to specialized reproductive health services?,هل تحصل النساء في سن الإنجاب (12-49) سنة على خدمات الصحة الانجابية المتخصصة لهم؟,,,true,,,,,,,,,,,,,,,,,,,
select_one yes_no,hh_member_distress,"47. Has any member of your household suffered or showed signs of psychosocial distress or trauma such as nightmare, lasting sadness, extreme fatigue, being often tearful or extreme anxiety, in the last 30 days?"," هل عانى أي فرد من أفراد أسرتك أو أظهر علامات على الاضطراب النفسي أو الصدمة مثل الكابوس والحزن الدائم والإرهاق الشديد ، والقلق الشديد في كثير من الأحيان للدموع أو القلق الشديد ، في آخر 30 يومًا؟",,,true,,,,,,,,,,,,,,,,,,,
integer,child_distress_number,"47.1 If yes, how many persons under 18 years showed those signs?","إذا كانت الإجابة بنعم ، فكم من الأشخاص الذين تقل أعمارهم عن 18 سنة أظهروا تلك العلامات؟",,,true,"selected(${hh_member_distress},'yes')",,.<=${num_hh_member},Number cannot be bigger than household size,ا يمكن أن يكون الرقم أكبر من عدد الأشخاص  الأسرة,,,,,,,,,,,,,,
integer,adult_distress_number,"47.2 If yes, how many persons above 18 years showed those signs?","إذا كانت الإجابة بنعم ، فكم من الأشخاص الذين تجاوزوا 18 عامًا أظهروا تلك العلامات؟",,,true,"selected(${hh_member_distress},'yes')",,.<=((${num_hh_member}-${child_distress_number})),Number cannot be bigger than household size,ا يمكن أن يكون الرقم أكبر من عدد الأشخاص  الأسرة,,,,,,,,,,,,,,
select_one yndd,health_accessed,"48. In the last three months, has anyone in your household needed to access health services or treatment (including medicines)","في الأشهر الثلاثة الأخيرة ، هل احتاج أي شخص في منزلك للوصول إلى الخدمات الصحية أو العلاج (بما في ذلك الأدوية)",,,true,,,,,,,,,,,,,,,,,,,
select_multiple health_barriers,health_barriers,"48.1 What difficulties, if any, are encountered when attempting to access health services or treatment?","ما الصعوبات ، إن وجدت ، التي واجهتها عند الوصول إلى الخدمات الصحية أو العلاج؟",,,true,"selected(${health_accessed},'yes')",,"not(selected(.,'no_issues') and count-selected(.)>1) ","Cannot select ""None"" together with any other option",لا ينبغي تحديد ( لاشيئ ) مع خيار آخر,,,,,,,,,,,,,,
select_one explosive,injured_explosive,"49. Has anyone in your household been injured or killed by an explosive ordnance since 2014 (e.g. landmines, bombs, missiles, IEDs, bullets or other explosive weapons from conflict)?",هل أصيب أحد أفراد أسرتك أو قتل بسبب ذخائر متفجرة منذ عام 2014 (مثل الألغام الأرضية أو القنابل أو الصواريخ أو العبوات الناسفة أو الرصاص أو الأسلحة المتفجرة الأخرى من الصراع)؟,,,true,,,,,,,,,,,,,,,,,,,
end_group,health_group,,,,,,,,,,,,,,,,,,,,,,,,
begin_group,wash,WASH Survey,الغسل,,,,,,,,,,,,,,,,,,,,,,
select_one water_source,drinking_water_source,50. What is the main source of water used by your household for drinking?,ماهو المصدر الرئيسي لمياه الشرب للاسرة  ( اختر ماينطبق),,,true,,,,,,,,,,,,,,,,,,,
text,drinking_water_source_other,"50.1 If other, please specify",اذا اخرى الرجاء الوصف,,,true,"selected(${drinking_water_source},'other')",,,,,,,,,,,,,,,,,,
select_one water_treating,treat_drink_water,51. Does your household treat the water in any way to make it safer for drinking?,هل تعالج أسرتك المياه بأي طريقة لجعلها أكثر أمانًا للشرب؟,,,true,"not(selected(${drinking_water_source},'shop'))",,,,,,,,,,,,,,,,,,
select_multiple why_safer_drinking,treat_drink_water_why,51.1 Why do you feel the need to treat it,لماذا تحتاج الى معالجة المياه او فلترتها؟,,,true,"not(selected(${drinking_water_source},'shop')) and (selected(${treat_drink_water},'always') or selected(${treat_drink_water},'sometimes'))",,"not(selected(.,'none') and count-selected(.)>1)","Cannot select ""None"" together with any other option",لا ينبغي تحديد ( لاشيئ ) مع خيار آخر,,,,,,,,,,,,,,
begin_group,water_sufficiency,Water Sufficiency,كفاية المياه,,,,,,,,,,field-list,,,,,,,,,,,,
note,sufficient_water,52. Does your household currently have enough water to meet the following needs?,هل تمتلك أسرتك حاليا ما يكفي من الماء لتلبية الاحتياجات التالية؟,,,,,,,,,,,,,,,,,,,,,,
select_one ynd1,sufficient_water_drinking,52.1 Drinking,الشرب,,,true,,,,,,,,,,,,,,,,,,,
select_one ynd1,sufficient_water_cooking,52.2 Cooking,الطبخ,,,true,,,,,,,,,,,,,,,,,,,
select_one ynd1,sufficient_water_hygiene,52.3 Personal hygiene (washing or bathing), النظافة الشخصية (الغسيل أو الاستحمام),,,true,,,,,,,,,,,,,,,,,,,
select_one ynd1,sufficient_water_other,"52.4 Other domestic purposes (cleaning house, floor, etc.)"," الأغراض المنزلية الأخرى (تنظيف المنزل ، الأرضية ، إلخ.)",,,true,,,,,,,,,,,,,,,,,,,
end_group,water_sufficiency,,,,,,,,,,,,,,,,,,,,,,,,
select_one latrines,latrines,53.What kind of sanitation facility (latrine/toilet) does your household usually use?,مانوع المرحاض او التواليت الذي تستعمله اسرتك عادةً؟,,,true,,,,,,,,,,,,,,,,,,,
text,latrines_other,"53.1 If other, please specify",اذا اخرى الرجاء الوصف,,,true,"selected(${latrines}, 'other')",,,,,,,,,,,,,,,,,,
select_one yes_no,shared_sanitation,53.2. Do you share this sanitation facility (latrine or toilet) with other households?,هل تتشاركون في هذه المرفق ( التواليت او المرحاض) مع اي أسر اخرى؟,,,true,"not(selected(${latrines},'none'))",,,,,,,,,,,,,,,,,,
select_one satisfaction,access_hygiene_items,"54. How satisfied is your household with regards to access to hygiene items (soap, feminine hygiene products, baby diapers, toothpaste/brush)?","ما مدى رضا أسرتك عن الوصول إلى مواد النظافة (الصابون ، منتجات النظافة الأنثوية ، حفاضات الأطفال ، معجون الأسنان / الفرشاة)؟",,,true,,,,,,,,,,,,,,,,,,,
select_one yes_no,access_soap,55. Do you have any soap in your household?,هل لديكم صابون للاسرة؟,,,true,,,,,,,,,,,,,,,,,,,
select_multiple use_of_soap,use_of_soap,"55.1 If yes, what do you use it for?","اذا نعم، بماذا تستخدم الصابون؟",,,true,"selected(${access_soap},'yes')",,"if(selected(.,'not'), count-selected(.)=1, count-selected(.)>=1)","Cannot select ""None"" together with any other option",لا ينبغي تحديد ( لاشيئ ) مع خيار آخر,,,,,,,,,,,,,,
text,use_of_soap_other,"55.2 If other, please specify",اذا اخرى الرجاء الوصف,,,true,"selected(${use_of_soap}, 'other')",,,,,,,,,,,,,,,,,,
end_group,wash,,,,,,,,,,,,,,,,,,,,,,,,
begin_group,s_nfi,Shelter & NFI survey,السكن والمواد الغير غذائية,,,,${calc_noteligible} = 0,,,,,,,,,,,,,,,,,,
select_one shelter_type,shelter_type_inperson,53. What type of shelter is the household currently living in? (observation by enumerator),مانوع المسكن الذي تعيش فيه حاليا؟ ( عن طريق الملاحظة من قبل الموظف),,,true,"selected(${dc_method}, 'in_person')",,,,,,,,,,,,,,,,,,
select_one shelter_type,shelter_type_remote,53. Could you describe the type of shelter that your household is currently living in?,هل يمكنك وصف نوع المسكن الذي تعيش فيه أسرتك حاليًا؟,,,true,"selected(${dc_method}, 'remote')",,,,,,,,,,,,,,,,,,
text,shelter_type_other,"53.1 If other, please describe","اذا كان الجواب اخر ,الرجاء الوصف",,,true,"selected(${shelter_type_inperson}, 'other') or selected(${shelter_type_remote}, 'other')",,,,,,,,,,,,,,,,,,
select_multiple enclosure_issues,enclosure_issues,54. Does the shelter have any of the following enclosure issues?  (top 2),هل يحتوي الملجأ او المسكن على أي من القضايا التالية؟ اختر اهم 2,,,true,,,"not(selected(.,'none') and count-selected(.)>1) and count-selected(.)<=2","You can select max 2 option and cannot select ""None"" and any other option.","لا ينبغي تحديد ( لاشيئ ) مع خيار آخر، اختر 2 كحد اقصى",,,,,,,,,,,,,,
select_multiple shelter_better,shelter_better,55. What are your priority needs to make your current shelter a better place to live (top 2)?,ما هي احتياجاتك ذات الأولوية  لجعل مسكنك الحالي مكانًا أفضل للعيش فيه ؟ اختر اهم 2,,,true,,,"not(selected(.,'none') and count-selected(.)>1) and count-selected(.)<=2","You can select max 2 option and cannot select ""None"" and any other option.","لا ينبغي تحديد ( لاشيئ ) مع خيار آخر، اختر 2 كحد اقصى",,,,,,,,,,,,,,
text,shelter_better_other,"55.1 If other, please describe","اذا كان الجواب اخر ,الرجاء الوصف",,,true,"selected(${shelter_better}, 'other')",,,,,,,,,,,,,,,,,,
select_multiple nfi_needs,nfi_priority_needs,56. Please indicate which of the following items you need but do not have in your household (select max. 2),"أي من المواد التالية التي تحتاج الى شرائها لعدم امتلاكك ما يكفي منها، أو لا تملك منها على الإطلاق ( اختار 2 كحد اقصى)",,,true,,,"not(selected(.,'none') and count-selected(.)>1) and count-selected(.)<=2","You can select max 2 option and cannot select ""none"" and any other option.","لا ينبغي تحديد ( لاشيئ ) مع خيار آخر، اختر 2 كحد اقصى",,,,,,,,,,,,,,
text,nfi_priority_needs_other,"56.1 If other, please describe","اذا كان الجواب اخر ,الرجاء الوصف",,,true,"selected(${nfi_priority_needs}, 'other')",,,,,,,,,,,,,,,,,,
end_group,s_nfi,,,,,,,,,,,,,,,,,,,,,,,,
begin_group,education,Education survey,التعليم,,,,${calc_noteligible} = 0,,,,,,,,,,,,,,,,,,
select_one place_primary,primary_school_place,57. How far is the closest functioning primary school to your location?,كم تبعد اقرب مدرسة ابتدائية تعمل في موقعك؟,30 minutes walking = 2 km (approximately),دقيقة مشي أي مايعادل 2كم بشكل تقريبي30,true,,,,,,,,,,,,,,,,,,,
select_one place_secondary,secondary_school_place,58. How far is the closest functioning secondary school to your location?,كم تبعد اقرب مدرسة متوسطة تعمل في موقعك؟,30 minutes walking = 2 km (approximately),دقيقة مشي أي مايعادل 2كم بشكل تقريبي30,true,,,,,,,,,,,,,,,,,,,
integer,covid_dropout,"59. Prior to the COVID-19 outbreak, how many school-aged children in your household dropped out of school during the current school year (2019-2020)?"," قبل بدء فيروس كورونا COVID-19 ، كم عدد الأطفال الذين هم في سن الدراسة في أسرتك ممن تركوا المدرسة ؟",Enter 0 if none,أدخل 0 إذا لم يكن هناك اي شيء,true,,,.<=${num_hh_member},Number cannot be bigger than household size,ا يمكن أن يكون الرقم أكبر من عدد الأشخاص  الأسرة,,,,,,,,,,,,,,
end_group,education,,,,,,,,,,,,,,,,,,,,,,,,
begin_group,livelihoods,Livelihoods survey,الحياة المعيشية,,,,${calc_noteligible} = 0,,,,,,,,,,,,,,,,,,
select_one ynd1,covid_loss_job,60. Has any member of your household lost their job permanently or temporarily as a result of the COVID-19 outbreak (including yourself if you lost your job)? ,هل فقد أي فرد من أسرتك وظيفته بشكل دائم أو مؤقت نتيجة لتفشي فيروس COVID-19 (بما في ذلك انت )؟,"Job losses should be directly attributable to COVID-19 policies, health issues from COVID-19, etc.","يجب أن يعزى فقدان الوظائف مباشرة إلى السياسات التي تم اتخاذها بسبب الفيروس COVID-19 ، والقضايا الصحية من الفيروس COVID-19 ، وما إلى ذلك. إذا لم يكن هناك شيء ، فأدخل 0.",true,,,,,,,,,,,,,,,,,,,
begin_group,covid_employment,Loss of employment due to COVID-19,فقدان الوظيفة بسبب الفيروس,,,,"selected(${covid_loss_job}, 'yes')",,,,,,field-list,,,,,,,,,,,,
note,covid_job_note,"61.1 If yes, how many members of your household have lost their job permanetly and how many temporarily?","كم عدد أفراد أسرتك ، إن وجد ، الذين فقدوا وظائفهم بشكل دائم أو مؤقت نتيجة لتفشي الفيروس COVID-19 (بما في ذلك انت إن كنت قد فقدت وظيفتك)؟","Job losses should be directly attributable to COVID-19 policies, health issues from COVID-19, etc. If none, enter 0.","يجب أن يعزى فقدان الوظائف مباشرة إلى السياسات التي تم اتخاذها بسبب الفيروس COVID-19 ، والقضايا الصحية من الفيروس COVID-19 ، وما إلى ذلك. إذا لم يكن هناك شيء ، فأدخل 0.",,,,,,,,,,,,,,,,,,,,
integer,covid_loss_job_permanent,Number of household members who permanently lost their job as a result of the COVID-19 outbreak,عدد أفراد الأسرة الذين فقدوا وظائفهم بشكل دائم نتيجة لتفشي الفيروس COVID-19,,,true,,,.<=${num_hh_member},Number cannot be bigger than household size,ا يمكن أن يكون الرقم أكبر من عدد الأشخاص  الأسرة,,minimal,,,,,,,,,,,,
integer,covid_loss_job_temp,Number of household members who temporarily lost their job as a result of the COVID-19 outbreak,عدد أفراد الأسرة الذين فقدوا وظائفهم مؤقتًا نتيجة لتفشي الفيروس COVID-19,,,true,,,.<=${num_hh_member},Number cannot be bigger than household size,ا يمكن أن يكون الرقم أكبر من عدد الأشخاص  الأسرة,,minimal,,,,,,,,,,,,
end_group,covid_employment,,,,,,,,,,,,,,,,,,,,,,,,
integer,tot_expenses,62. Could you estimate your household's total expenditure (in IQD) over the last 30 days?,هل يمكنك تقدير إجمالي إنفاق أسرتك (بالدينار العراقي) خلال الثلاثين يومًا الماضية؟,,,true,,,.=0 or .>=999 and .<= 10000000,,,,,,,,,,,,,,,,
begin_group,expenses,,,,,,,,,,,,field-list,,,,,,,,,,,,
note,exp_note,"63. During the past 30 days, how much did your household spend (in IQD) on each of the following categories?","خلال الثلاثين يومًا الماضية ، كم أنفقت أسرتك (بالدينار العراقي) على كل فئة من الفئات التالية؟","Please enter the FULL IQD amount (i.e. 1,000 IQD)",الرجاء ادخال الرقم بشكل كامل بالدينار العراقي ( مثال: 1000 دينار),,,,,,,,,,,,,,,,,,,,
integer,rent_exp,63.1 Rent,الايجار,,,true,,,.=0 or .>=999 and .<= 10000000,,,,,,,,,,,,,,,,
integer,medical_exp,63.2 Medical care (including medicines),الرعاية الصحية ( بما فيها الادوية),,,true,,,.=0 or .>=999 and .<= 10000000,,,,,,,,,,,,,,,,
integer,food_exp,63.3 Food,الغذاء,,,true,,,.=0 or .>=999 and .<= 10000000,,,,,,,,,,,,,,,,
calculate,calc_expenditure,,,,,,,,,,,${rent_exp}+${medical_exp}+${food_exp},,,,,,,,,,,,,
note,exp_compare,"The expenditure for rent, medical care and food cannot be larger than the total expenditure",لا يمكن أن يكون الإنفاق على الإيجار والرعاية الطبية والغذاء أكبر من إجمالي الإنفاق,,,true,${calc_expenditure} > ${tot_expenses},,,,,,,,,,,,,,,,,,
end_group,,,,,,,,,,,,,,,,,,,,,,,,,
select_multiple livelihood_type,primary_livelihood,64. What were your household's primary income sources over the last 30 days?  (do not read out from list),ماذا كانت مصادر الدخل الأساسية للاسرة الخاصة بك على مدى 30 يوما الماضية؟  ( لا تقرأ من القائمة ),,,true,,,"if(selected(.,'none'), count-selected(.)=1, count-selected(.)>=1)","Cannot select ""None"" together with any other option",لا ينبغي تحديد ( لاشيئ ) مع خيار آخر,,,,,,,,,,,,,,
text,primary_livelihood_other,"64.1 if other, specify please","إذا أخرى, الرجاء الشرح",,,true,"selected(${primary_livelihood},'other')",,,,,,,,,,,,,,,,,,
select_one ynd,employment_seasonal,65. Is all of this employment seasonal/temporary?,هل كل هذا العمل او التوظيف مؤقت او موسمي؟,,,true,"selected(${primary_livelihood},'employment')",,,,,,,,,,,,,,,,,,
integer,inc_employment_pension,66. Could you estimate your household's total income (in IQD) from employment and pension over the last 30 days?, هل يمكنك تقدير إجمالي دخل أسرتك (بالدينار العراقي) من العمل والراتب التقاعدي على مدار الثلاثين يومًا الماضية؟,,,true,,,.=0 or .>=9999  and .<= 100000000,,,,,,,,,,,,,,,,
integer,how_much_debt,"67. What is your household's total amount of debt, in IQD?","بالدينار العراقي,كم من الدين المستحق على اسرتك  ؟",,,true,,,.=0 or .>=999,,,,,,,,,,,,,,,,
select_one reasons_for_debt,reasons_for_debt,67.1 What was the primary reason behind taking on debt?,ما ذا كان السبب الرئيسي وراء اقتراض المال؟,,,true,${how_much_debt}>0,,,,,,,,,,,,,,,,,,
text,other_reasons_for_debt,"67.2 If other, specify please","إذا أخرى, الرجاء الشرح",,,true,"selected(${reasons_for_debt},'other')",,,,,,,,,,,,,,,,,,
select_one place3,market_place,68. For how long do members of your household have to travel on foot to reach the nearest operational marketplace or grocery store?,لكم من الوقت يتعين على الاسرة للسير مشياً للوصول الى اقرب سوق او محل بقالة يعمل؟,30 minutes walking = 2 km (approximately),30دقيقة مشي أي مايعادل 2كم بشكل تقريبي,true,,,,,,,,,,,,,,,,,,,
end_group,livelihoods,,الحياة المعيشية,,,,,,,,,,,,,,,,,,,,,,
begin_group,protection,Protection survey,الحماية,,,,${calc_noteligible} = 0,,,,,,,,,,,,,,,,,,
select_one ynd,hlp_document,"69. Does you household own valid documentation indicating land tenure or rental agreement for the property you are currently living in, or own elsewhere?",هل تمتلك أسرتك وثائق صالحة تشير إلى حيازة الأرض أو اتفاقية الإيجار للعقار الذي تعيش فيه حاليًا أو تملكه في مكان آخر؟,,,true,,,,,,,,,,,,,,,,,,,
select_one yndd,hh_dispute,"70. Is the property you are currently living in, or own elsewhere, under any kind of dispute?",هل الملكية التي تعيش فيها حالياً أو تملكها في مكان آخر تحت أي نوع من انواع النزاع؟,A dispute is if someone is contesting ownership over the property.,النزاع هو اذا ماكان شخص ما يتنافس على ملكية العقار,true,,,,,,,,,,,,,,,,,,,
select_one yndd,hh_risk_eviction,71. Is your household presently at risk of eviction?,هل تخشى اسرتك حاليا من خطر الاخلاء؟,,,true,,,,,,,,,,,,,,,,,,,
note,ref_evic,"This is household is presently at risk of eviction, please refer to the Iraq Information Centre (IIC) hotline 800 6 9999","هذه الاسرة معرّضة لخطر الاخلاء، يرجى الرجوع الى رقم الخط الساخن لمركز معلومات العراق    ICC) 800 6 9999)     ",,,,"selected(${hh_risk_eviction}, 'yes')",,,,,,,,,,,,,,,,,,
select_multiple eviction,hh_main_risks,71.1 What are the main reasons for fearing eviction?,ماهي الاسباب الرئيسية لخطر الإخلاء بالنسبة للاسرة؟,,,true,"selected(${hh_risk_eviction}, 'yes')",,,,,,,,,,,,,,,,,,
text,hh_main_risks_other,"71.2 If other, please describe","اذا كان الجواب اخر ,الرجاء الوصف",,,true,"selected(${hh_main_risks}, 'other')",,,,,,,,,,,,,,,,,,
select_one property_damaged,property_damaged,"72. Was housing, land or property that you own damaged during the conflict?",هل تضررت المساكن أو الأرض أو الممتلكات التي كنت تمتلكها أثناء النزاع؟,,,true,,,,,,,,,,,,,,,,,,,
select_one yndd,aware_compensation,"73. Are you aware of any land, housing or property compensation mechanism?",هل أنت على دراية بأي آلية لتعويض الأراضي أو المساكن أو الممتلكات؟,,,true,"selected(${property_damaged},'yes')",,,,,,,,,,,,,,,,,,
select_one yndd,applied_compensation,"73.1 Have you applied for housing, land or property compensation?",هل تقدمت بطلب للحصول على تعويض عن السكن أو الأرض أو العقار؟,,,true,"selected(${property_damaged},'yes') and selected(${aware_compensation}, 'yes')",,,,,,,,,,,,,,,,,,
select_one yndd,received_compensation,"73.2 Have you received any cash from the government as a result of your housing, land or property compensation application?",هل تلقيت أي مبالغ نقدية من الحكومة نتيجة لطلبك للحصول على تعويض عن السكن أو الأرض أو العقار؟,,,true,"selected(${applied_compensation},'yes')",,,,,,,,,,,,,,,,,,
select_one ynd_doc,pds_card,74. Does your household have a valid PDS card?,هل تمتلك اسرتك بطاقة تموينية نافذة او صالحة؟,,,true,,,,,,,,,,,,,,,,,,,
begin_group,missing_documents_above_18,Missing documents above 18,,For EVERY person in HH ABOVE 18!,لكل الاشخاص في الاسرة فوق ال18 سنة,true,,,,,,,field-list,,,,,,,,,,,,
note,note_missing_documents_above_18,"78. Does every person above 18 in your household have the following documents? This means you have it, it is valid, and it is stored in a secure place.","هل لدى كل شخص فوق 18 عامًا في منزلك الوثائق التالية؟ هذا يعني أنه لديك ، إنه نافذ ،  و  يتم حفظه في مكان آمن.",,,,,,,,,,,,,,,,,,,,,,
select_one yndd,id_card_a18,78.1 National ID card or unified ID card,هوية الاحوال المدنية او  البطاقة الموحدة, Unified ID replaces both ID card and nationality certificate.,الهوية الموحدة تحل محل كل من بطاقة الهوية وشهادة الجنسية.,true,,,,,,,,,,,,,,,,,,,
select_one yndd,nationality_cert_a18,78.2 Nationality certificate or unified ID card,بطاقة الجنسية او البطاقة الموحدة, Unified ID replaces both ID card and nationality certificate.,الهوية الموحدة تحل محل كل من بطاقة الهوية وشهادة الجنسية.,true,,,,,,,,,,,,,,,,,,,
end_group,,,,,,,,,,,,,,,,,,,,,,,,,
begin_group,missing_documents_under_18,Missing documents under 18,الوثائق المفقودة للافراد تحت سن ال18,For EVERY person in HH UNDER 18!,لكل الاشخاص في الاسرة تحت ال18 سنة,true,,,,,,,field-list,,,,,,,,,,,,
note,note_missing_documents_under_18,"79. Does every person under 18 in your household have the following documents? This means you have it, it is valid, and it is stored in a secure place.","هل لدى كل شخص تحت سن ال 18 عامًا في منزلك الوثائق التالية؟ هذا يعني أنه لديك ، إنه نافذ ،  و  يتم حفظه في مكان آمن.",,,,,,,,,,,,,,,,,,,,,,
select_one yndd,id_card_u18,79.1 National ID card or unified ID card,هوية الاحوال المدنية او  البطاقة الموحدة, Unified ID replaces both ID card and nationality certificate.,الهوية الموحدة تحل محل كل من بطاقة الهوية وشهادة الجنسية.,true,,,,,,,,,,,,,,,,,,,
select_one yndd,nationality_cert_u18,79.2 Nationality certificate or unified ID card,بطاقة الجنسية او البطاقة الموحدة, Unified ID replaces both ID card and nationality certificate.,الهوية الموحدة تحل محل كل من بطاقة الهوية وشهادة الجنسية.,true,,,,,,,,,,,,,,,,,,,
select_one yndd,birth_cert_u18,79.3 Birth certificate,شهادة الميلاد,,,true,,,,,,,,,,,,,,,,,,,
end_group,,,,,,,,,,,,,,,,,,,,,,,,,
